{
  "id": 424571,
  "title": "Bacon King Burger",
  "restaurantChain": "Burger King",
  "nutrition": {
    "nutrients": [
      {
        "name": "Fat",
        "amount": 69,
        "unit": "g",
        "percentOfDailyNeeds": 30
      },
      {
        "name": "Protein",
        "amount": 57,
        "unit": "g",
        "percentOfDailyNeeds": 35
      },
      {
        "name": "Calories",
        "amount": 1040,
        "unit": "cal",
        "percentOfDailyNeeds": 50
      },
      {
        "name": "Carbohydrates",
        "amount": 48,
        "unit": "g",
        "percentOfDailyNeeds": 35
      }
    ],
    "caloricBreakdown": {
      "percentProtein": 35,
      "percentFat": 30,
      "percentCarbs": 35
    }
  },
  "badges": [],
  "breadcrumbs": [
    "burger",
    "main course",
    "food product category"
  ],
  "generatedText": "",
  "imageType": "png",
  "likes": 0,
  "servings": {
    "number": 1,
    "size": 2,
    "unit": "oz"
  },
  "price": 2.35,
  "spoonacularScore": 12.5
}